commit	val_bpb	training_seconds	total_seconds	peak_vram_mb	mfu_percent	total_tokens_M	num_steps	num_params_M	depth	status	description
unknown	1.861346	180.2	223.8	42204.0	41.10	270.0	515	33.6	8	keep	baseline
unknown	1.405058	180.1	206.0	42084.0	41.01	266.6	1017	33.6	8	keep	halve global batch for more optimizer updates
unknown	1.305631	180.0	210.0	21289.0	31.88	206.4	1575	33.6	8	keep	quarter global batch for more optimizer updates
unknown	1.219795	180.0	206.3	10891.5	38.87	250.8	3827	33.6	8	keep	eighth global batch for still more updates
unknown	1.222502	180.0	217.8	5692.8	35.74	230.3	7028	33.6	8	discard	sixteenth global batch for update frequency
unknown	1.230508	180.0	209.4	10891.5	38.86	250.7	3826	33.6	8	discard	raise matrix lr to 0.05
unknown	1.197274	180.0	205.6	10891.5	38.90	250.9	3829	33.6	8	keep	lower matrix lr to 0.035
unknown	1.205121	180.0	205.7	10891.5	38.83	250.5	3823	33.6	8	discard	lower matrix lr to 0.03
unknown	1.202459	180.0	206.4	10891.5	38.87	250.7	3826	33.6	8	discard	refine matrix lr to 0.034
